{
  "description" : "Agreement for Fast Speed Plan" ,
  "start_date" : "2015-02-19T00:37:04Z" ,
  "plan" : {
    "id" : "P-0NJ10521L3680291SOAQIVTQ"
  } ,
  "payer" : {
    "payment_method" : "paypal"
  } ,
  "shipping_address" : {
    "line1" : "StayBridge Suites" ,
    "line2" : "Crok Street" ,
    "city" : "San Jose" ,
    "state" : "CA" ,
    "postal_code" : "95112" ,
    "country_code" : "US"
  }
}